{
  "object_type": "EnterpriseProcessPlanningAgentResult",
  "schema_version": "autoform.enterprise_process_planning.r17.v1",
  "phase": "R17",
  "task_id": "task_r17_enterprise_process_candidate",
  "evidence_bundle": {
    "schema_version": "autoform.process_rag_evidence_bundle.r16.v1",
    "object_type": "EvidenceBundle",
    "phase": "R16",
    "evidence_bundle_id": "evidence_r16_process_rag_sample",
    "query": "DC04 D-20 blank thickness process route",
    "filters": {
      "material_grade": "DC04",
      "blank_thickness_mm": 1.0,
      "process_action": "D-20"
    },
    "source_refs": [
      {
        "source_id": "source_enterprise_internal_dataset_pending",
        "title": "Enterprise internal dataset placeholder",
        "path_or_url": "pending_internal_directory",
        "source_type": "internal_pending",
        "captured_at": "pending",
        "reviewed": false,
        "permission_level": "P2",
        "license_status": "pending_internal_permission",
        "review_status": "candidate",
        "applicability": "R13 placeholder for future internal material process case and quality data",
        "limitation": "No data ingestion until owner permission source hash and confidentiality are confirmed"
      }
    ],
    "evidence_refs": [
      {
        "evidence_id": "record_r14_sample_material_001",
        "source_id": "source_enterprise_internal_dataset_pending",
        "source_hash": "d9ef6dbbe85f221488897c4ddc02333d2b5e63d9a8b820d2e9d9253beb48737e",
        "artifact_uri": "data/rag/enterprise/r14_small_batch_samples.jsonl",
        "evidence_type": "cleaned_record"
      },
      {
        "evidence_id": "record_r14_sample_process_001",
        "source_id": "source_enterprise_internal_dataset_pending",
        "source_hash": "4b99e9162c9569b0fe9c37daf79a95b00e0f24ae1efcb59b024f085900c843e8",
        "artifact_uri": "data/rag/enterprise/r14_small_batch_samples.jsonl",
        "evidence_type": "cleaned_record"
      }
    ],
    "card_refs": [
      {
        "card_id": "pkc_r15_parameter_blank_thickness_pending_001",
        "card_type": "ParameterWindow",
        "source_id": "source_enterprise_internal_dataset_pending",
        "source_permission_level": "P2",
        "version": "pending",
        "review_status": "candidate",
        "license_status": "pending_internal_permission",
        "allowed_usage": "candidate_knowledge_card_only",
        "applicability": {
          "applicable_materials": [
            "DC04"
          ],
          "part_features": [
            "generic_sheet_metal_draw_part_pending_geometry"
          ],
          "process_actions": [
            "D-20"
          ],
          "applicable_lines": [
            "pending_line_review"
          ],
          "conflict_status": "none"
        },
        "limitation": "No data ingestion until owner permission source hash and confidentiality are confirmed",
        "score": 14,
        "ranking_reasons": [
          "text_match:20",
          "text_match:blank",
          "text_match:d",
          "text_match:dc04",
          "text_match:process",
          "text_match:thickness",
          "filter_match:material_grade",
          "filter_match:blank_thickness_mm",
          "filter_match:process_action"
        ],
        "formal_index_allowed": false
      },
      {
        "card_id": "pkc_r15_process_case_dc04_d20_pending_001",
        "card_type": "ProcessCase",
        "source_id": "source_enterprise_internal_dataset_pending",
        "source_permission_level": "P2",
        "version": "pending",
        "review_status": "candidate",
        "license_status": "pending_internal_permission",
        "allowed_usage": "candidate_knowledge_card_only",
        "applicability": {
          "applicable_materials": [
            "DC04"
          ],
          "part_features": [
            "generic_sheet_metal_draw_part_pending_geometry"
          ],
          "process_actions": [
            "D-20"
          ],
          "applicable_lines": [
            "pending_line_review"
          ],
          "conflict_status": "none"
        },
        "limitation": "No data ingestion until owner permission source hash and confidentiality are confirmed",
        "score": 12,
        "ranking_reasons": [
          "text_match:20",
          "text_match:d",
          "text_match:dc04",
          "text_match:process",
          "filter_match:material_grade",
          "filter_match:blank_thickness_mm",
          "filter_match:process_action"
        ],
        "formal_index_allowed": false
      }
    ],
    "summary": "R16 candidate EvidenceBundle matched 2 process knowledge cards: ParameterWindow, ProcessCase; conflict_status=none.",
    "applicability": "materials=DC04; process_actions=D-20",
    "limitation": "No data ingestion until owner permission source hash and confidentiality are confirmed | Candidate bundle only; it cannot update formal engineering state or submit AutoForm solving.",
    "confidence": "low",
    "review_status": "candidate",
    "human_review_status": "required",
    "conflict_status": "none",
    "retrieval_run": {
      "retrieval_run_id": "retrieval_evidence_r16_process_rag_sample",
      "index_version": "autoform.process_rag.r16.v1",
      "candidate_card_count": 6,
      "matched_card_count": 2,
      "formal_index_allowed_count": 0,
      "filters_applied": {
        "material_grade": "DC04",
        "blank_thickness_mm": 1.0,
        "process_action": "D-20"
      },
      "ranking_explanation": [
        {
          "card_id": "pkc_r15_parameter_blank_thickness_pending_001",
          "score": 14,
          "reasons": [
            "text_match:20",
            "text_match:blank",
            "text_match:d",
            "text_match:dc04",
            "text_match:process",
            "text_match:thickness",
            "filter_match:material_grade",
            "filter_match:blank_thickness_mm",
            "filter_match:process_action"
          ]
        },
        {
          "card_id": "pkc_r15_process_case_dc04_d20_pending_001",
          "score": 12,
          "reasons": [
            "text_match:20",
            "text_match:d",
            "text_match:dc04",
            "text_match:process",
            "filter_match:material_grade",
            "filter_match:blank_thickness_mm",
            "filter_match:process_action"
          ]
        }
      ],
      "excluded_cards": [
        {
          "card_id": "pkc_r15_material_dc04_pending_001",
          "card_type": "MaterialCard",
          "source_id": "source_enterprise_internal_dataset_pending",
          "reasons": [
            "process_action_filtered"
          ]
        },
        {
          "card_id": "pkc_r15_operation_route_d20_pending_001",
          "card_type": "OperationRoute",
          "source_id": "source_enterprise_internal_dataset_pending",
          "reasons": [
            "thickness_filtered"
          ]
        },
        {
          "card_id": "pkc_r15_quality_traceability_gate_001",
          "card_type": "QualityCriteria",
          "source_id": "source_enterprise_internal_dataset_pending",
          "reasons": [
            "process_action_filtered",
            "thickness_filtered"
          ]
        },
        {
          "card_id": "pkc_r15_public_literature_metadata_arxiv_001",
          "card_type": "ProcessCase",
          "source_id": "source_arxiv_api_metadata",
          "reasons": [
            "material_filtered",
            "process_action_filtered",
            "thickness_filtered"
          ]
        }
      ],
      "blocked_actions": [
        "write_formal_engineering_state",
        "submit_solver",
        "control_gui"
      ]
    },
    "created_at": "2026-06-03T05:00:00+00:00"
  },
  "evidence_assessment": {
    "object_type": "EnterpriseProcessEvidenceAssessment",
    "status": "needs_review",
    "blockers": [
      "low_confidence_evidence",
      "missing_applicable_line",
      "missing_material_curve",
      "no_formal_index_cards"
    ],
    "checks": [
      {
        "name": "has_card_refs",
        "status": "pass",
        "observed": null
      },
      {
        "name": "conflict_status",
        "status": "pass",
        "observed": "none"
      },
      {
        "name": "confidence_not_low",
        "status": "needs_review",
        "observed": "low"
      },
      {
        "name": "has_formal_index_cards",
        "status": "needs_review",
        "observed": null
      },
      {
        "name": "has_material_card",
        "status": "needs_review",
        "observed": null
      },
      {
        "name": "has_parameter_window",
        "status": "pass",
        "observed": null
      },
      {
        "name": "has_reviewed_applicable_line",
        "status": "needs_review",
        "observed": null
      }
    ],
    "evidence_bundle_id": "evidence_r16_process_rag_sample",
    "created_at": "2026-06-03T06:00:00+00:00"
  },
  "process_plan_card": {
    "object_type": "ProcessPlanCard",
    "schema_version": "autoform.enterprise_process_plan.r17.v1",
    "phase": "R17",
    "process_plan_id": "process_plan_r17_enterprise_candidate",
    "task_id": "task_r17_enterprise_process_candidate",
    "part_id": "part_r17_enterprise_candidate",
    "material_id": "material_r17_enterprise_candidate",
    "material_grade": "DC04",
    "route": {
      "object_type": "OperationRoute",
      "route_id": "route_r17_enterprise_candidate",
      "operations": [
        {
          "operation_id": "D-20",
          "name": "enterprise_evidence_candidate_operation",
          "status": "candidate",
          "source_card_ids": []
        }
      ],
      "review_status": "needs_human_confirmation"
    },
    "parameter_candidates": [
      {
        "object_type": "ParameterCandidate",
        "parameter_id": "param_r17_blank_thickness_mm",
        "name": "blank_thickness_mm",
        "value": 1.0,
        "unit": "mm",
        "window": [
          1.0,
          1.0